{
  "metadata": {
    "video_id": "scene-0903",
    "dataset": "NuScenes"
  },
  "environment": {
    "road_type": "Urban",
    "intersection": true,
    "traffic_control": "Traffic signal",
    "weather": "Rain",
    "lighting": "Day"
  },
  "scenario_behavior": {
    "event_type": "Vehicle Interaction",
    "event_pattern": "Cross-linear",
    "severity": "Medium",
    "ego_maneuver": "Stop",
    "key_event": "Car from the left turns across the ego path at a signalized intersection",
    "time_window": {
      "end_sec": "00:10",
      "start_sec": "00:05"
    }
  },
  "actors": [
    {
      "class": "car",
      "count": 1,
      "relative_position": "front_left"
    },
    {
      "class": "car",
      "count": 1,
      "relative_position": "front"
    },
    {
      "class": "bus",
      "count": 1,
      "relative_position": "front_right"
    },
    {
      "class": "pedestrian",
      "count": 1,
      "relative_position": "crossing"
    }
  ]
}
