{
  "metadata": {
    "video_id": "scene-0909",
    "dataset": "NuScenes"
  },
  "environment": {
    "road_type": "Urban",
    "intersection": true,
    "traffic_control": "Traffic signal",
    "weather": "Rain",
    "lighting": "Day"
  },
  "scenario_behavior": {
    "event_type": "Vehicle Interaction",
    "event_pattern": "Co-linear",
    "severity": "Low",
    "ego_maneuver": "Follow",
    "key_event": "Ego vehicle follows traffic and approaches queuing vehicles across a bridge in rainy weather",
    "time_window": {
      "start_sec": "00:12",
      "end_sec": "00:19"
    }
  },
  "actors": [
    {
      "class": "car",
      "count": 5,
      "relative_position": "front"
    },
    {
      "class": "van",
      "count": 1,
      "relative_position": "front_left"
    }
  ]
}
