{
  "metadata": {
    "video_id": "scene-0236",
    "dataset": "NuScenes"
  },
  "environment": {
    "road_type": "Urban",
    "intersection": false,
    "traffic_control": "Traffic signal",
    "weather": "Clear",
    "lighting": "Day"
  },
  "scenario_behavior": {
    "event_type": "Vehicle Interaction",
    "event_pattern": "Co-linear",
    "severity": "Low",
    "ego_maneuver": "Follow",
    "key_event": "The ego vehicle follows a white truck and other vehicles on the road.",
    "time_window": {
      "start_sec": "00:00",
      "end_sec": "00:10"
    }
  },
  "actors": [
    {
      "class": "car",
      "count": 2,
      "relative_position": "front_left"
    },
    {
      "class": "truck",
      "count": 1,
      "relative_position": "front_right"
    }
  ]
}
