{
  "metadata": {
    "video_id": "REC_20240609_145944_2",
    "dataset": "Dashcam"
  },
  "environment": {
    "road_type": "Semi-urban",
    "intersection": false,
    "traffic_control": "None",
    "weather": "Clear",
    "lighting": "Day"
  },
  "scenario_behavior": {
    "event_type": "Vehicle Interaction",
    "event_pattern": "Co-linear",
    "severity": "Low",
    "ego_maneuver": "Follow",
    "key_event": "Ego vehicle follows an auto-rickshaw navigating a curved paved road with pedestrians along the side",
    "time_window": {
      "start_sec": "00:00",
      "end_sec": "00:05"
    }
  },
  "actors": [
    {
      "class": "auto_rickshaw",
      "count": 1,
      "relative_position": "front"
    },
    {
      "class": "pedestrian",
      "count": 4,
      "relative_position": "front_left"
    }
  ]
}
