{
  "metadata": {
    "video_id": "EVT_20240610_072215_2",
    "dataset": "Dashcam"
  },
  "environment": {
    "road_type": "Highway",
    "intersection": false,
    "traffic_control": "None",
    "weather": "Cloudy",
    "lighting": "Day"
  },
  "scenario_behavior": {
    "event_type": "Vehicle Interaction",
    "event_pattern": "Co-linear",
    "severity": "Low",
    "ego_maneuver": "Follow",
    "key_event": "Ego vehicle following lead car in same lane while a truck travels in the adjacent right lane.",
    "time_window": {
      "start_sec": "00:00",
      "end_sec": "00:10"
    }
  },
  "actors": [
    {
      "class": "car",
      "count": 2,
      "relative_position": "front_right"
    },
    {
      "class": "truck",
      "count": 1,
      "relative_position": "right"
    }
  ]
}
