{
  "metadata": {
    "video_id": "2011_09_26_drive_0084_sync_camera_03_part1",
    "dataset": "KITTI"
  },
  "environment": {
    "road_type": "Urban",
    "intersection": true,
    "traffic_control": "Traffic signal",
    "weather": "Clear",
    "lighting": "Day"
  },
  "scenario_behavior": {
    "event_type": "Traffic Control",
    "event_pattern": "Cross-linear",
    "severity": "Low",
    "ego_maneuver": "Stop",
    "key_event": "Ego stopped/approaching at intersection controlled by red traffic light and stop sign",
    "time_window": {
      "end_sec": "00:05",
      "start_sec": "00:00"
    }
  },
  "actors": [
    {
      "class": "car",
      "count": 4,
      "relative_position": "front"
    },
    {
      "class": "car",
      "count": 1,
      "relative_position": "front_left"
    },
    {
      "class": "car",
      "count": 1,
      "relative_position": "front_right"
    }
  ]
}
