{
  "metadata": {
    "video_id": "REC_20240609_145013_2_part1",
    "dataset": "Dashcam"
  },
  "environment": {
    "road_type": "Highway",
    "intersection": false,
    "traffic_control": "None",
    "weather": "Cloudy",
    "lighting": "Day"
  },
  "scenario_behavior": {
    "event_type": "Vehicle Interaction",
    "event_pattern": "Cross-linear",
    "severity": "Low",
    "ego_maneuver": "Go straight",
    "key_event": "A white SUV overtakes and cuts into the ego lane from the right",
    "time_window": {
      "start_sec": "00:03",
      "end_sec": "00:08"
    }
  },
  "actors": [
    {
      "class": "car",
      "count": 1,
      "relative_position": "front_right"
    },
    {
      "class": "car",
      "count": 1,
      "relative_position": "front_left"
    },
    {
      "class": "truck",
      "count": 1,
      "relative_position": "front"
    }
  ]
}
