{
  "metadata": {
    "video_id": "20211221155505_0060_combined_part1",
    "dataset": "IDD"
  },
  "environment": {
    "road_type": "Urban",
    "intersection": false,
    "traffic_control": "Unknown",
    "weather": "Clear",
    "lighting": "Day"
  },
  "scenario_behavior": {
    "event_type": "Vehicle Interaction",
    "event_pattern": "Causal",
    "severity": "Low",
    "ego_maneuver": "Stop",
    "key_event": "Bus stopped ahead blocking ego lane causing traffic to stop",
    "time_window": {
      "end_sec": "00:10",
      "start_sec": "00:05"
    }
  },
  "actors": [
    {
      "class": "bus",
      "count": 1,
      "relative_position": "front"
    },
    {
      "class": "car",
      "count": 1,
      "relative_position": "front_left"
    },
    {
      "class": "car",
      "count": 2,
      "relative_position": "front_right"
    },
    {
      "class": "motorcycle",
      "count": 3,
      "relative_position": "front_left"
    },
    {
      "class": "truck",
      "count": 1,
      "relative_position": "front_right"
    },
    {
      "class": "auto_rickshaw",
      "count": 1,
      "relative_position": "front"
    }
  ]
}
