{
  "metadata": {
    "video_id": "REC_20240609_095724_2_part3",
    "dataset": "Dashcam"
  },
  "environment": {
    "road_type": "Urban",
    "intersection": false,
    "traffic_control": "None",
    "weather": "Clear",
    "lighting": "Day"
  },
  "scenario_behavior": {
    "event_type": "Vehicle Interaction",
    "event_pattern": "Co-linear",
    "severity": "Low",
    "ego_maneuver": "Follow",
    "key_event": "Ego vehicle following a white sedan in the same lane while a vehicle is present to the front-right",
    "time_window": {
      "end_sec": "00:05",
      "start_sec": "00:00"
    }
  },
  "actors": [
    {
      "class": "car",
      "count": 1,
      "relative_position": "front"
    },
    {
      "class": "car",
      "count": 1,
      "relative_position": "front_right"
    },
    {
      "class": "motorcycle",
      "count": 2,
      "relative_position": "sidewalk_right"
    },
    {
      "class": "truck",
      "count": 1,
      "relative_position": "front_left"
    }
  ]
}
