{
  "metadata": {
    "video_id": "20220214145650_0060_combined_part1",
    "dataset": "IDD"
  },
  "environment": {
    "road_type": "Urban",
    "intersection": true,
    "traffic_control": "Traffic signal",
    "weather": "Clear",
    "lighting": "Day"
  },
  "scenario_behavior": {
    "event_type": "Animal & Pedestrian",
    "event_pattern": "Cross-linear",
    "severity": "Medium",
    "ego_maneuver": "Go straight",
    "key_event": "Pedestrian crossing road in front of ego vehicle",
    "time_window": {
      "start_sec": "00:15",
      "end_sec": "00:18"
    }
  },
  "actors": [
    {
      "class": "pedestrian",
      "count": 1,
      "relative_position": "front_left"
    },
    {
      "class": "bus",
      "count": 1,
      "relative_position": "front_left"
    },
    {
      "class": "motorcycle",
      "count": 1,
      "relative_position": "front"
    }
  ]
}
