{
  "metadata": {
    "video_id": "20220214145650_0060_combined_part1",
    "dataset": "IDD"
  },
  "environment": {
    "road_type": "Urban",
    "intersection": false,
    "traffic_control": "None",
    "weather": "Clear",
    "lighting": "Day"
  },
  "scenario_behavior": {
    "event_type": "Vehicle Interaction",
    "event_pattern": "Co-linear",
    "severity": "Low",
    "ego_maneuver": "Follow",
    "key_event": "A motorcycle and a truck are seen ahead on the road, indicating potential lane changes or overtaking.",
    "time_window": {
      "start_sec": "00:00",
      "end_sec": "00:10"
    }
  },
  "actors": [
    {
      "class": "motorcycle",
      "count": 2,
      "relative_position": "front"
    },
    {
      "class": "truck",
      "count": 1,
      "relative_position": "front_right"
    }
  ]
}
