{
  "metadata": {
    "video_id": "2011_09_26_drive_0005_sync_camera_03",
    "dataset": "KITTI"
  },
  "environment": {
    "road_type": "Urban",
    "intersection": true,
    "traffic_control": "Traffic signal",
    "weather": "Clear",
    "lighting": "Day"
  },
  "scenario_behavior": {
    "event_type": "Vehicle Interaction",
    "event_pattern": "Co-linear",
    "severity": "Low",
    "ego_maneuver": "Go straight",
    "key_event": "Cyclist moves from right sidewalk/edge into the road ahead of ego",
    "time_window": {
      "end_sec": "00:05",
      "start_sec": "00:00"
    }
  },
  "actors": [
    {
      "class": "bicycle",
      "count": 1,
      "relative_position": "front_right"
    },
    {
      "class": "car",
      "count": 1,
      "relative_position": "front"
    },
    {
      "class": "bicycle",
      "count": 3,
      "relative_position": "sidewalk_right"
    }
  ]
}
