{
  "metadata": {
    "video_id": "scene-0335",
    "dataset": "NuScenes"
  },
  "environment": {
    "road_type": "Urban",
    "intersection": true,
    "traffic_control": "Traffic signal",
    "weather": "Clear",
    "lighting": "Day"
  },
  "scenario_behavior": {
    "event_type": "Traffic Control",
    "event_pattern": "Co-linear",
    "severity": "Low",
    "ego_maneuver": "Follow",
    "key_event": "Ego vehicle following a white SUV through a green traffic signal at an intersection",
    "time_window": {
      "end_sec": "00:06",
      "start_sec": "00:00"
    }
  },
  "actors": [
    {
      "class": "car",
      "count": 1,
      "relative_position": "ego_lane"
    },
    {
      "class": "car",
      "count": 1,
      "relative_position": "front_left"
    },
    {
      "class": "car",
      "count": 1,
      "relative_position": "front"
    },
    {
      "class": "truck",
      "count": 1,
      "relative_position": "front_right"
    }
  ]
}
