{
  "metadata": {
    "video_id": "2011_09_29_drive_0071_sync_camera_03_part6",
    "dataset": "KITTI"
  },
  "environment": {
    "road_type": "Urban",
    "intersection": false,
    "traffic_control": "None",
    "weather": "Clear",
    "lighting": "Day"
  },
  "scenario_behavior": {
    "event_type": "Vehicle Interaction",
    "event_pattern": "Co-linear",
    "severity": "Low",
    "ego_maneuver": "Follow",
    "key_event": "A pedestrian crosses the road in front of the ego vehicle.",
    "time_window": {
      "start_sec": "00:00",
      "end_sec": "00:10"
    }
  },
  "actors": [
    {
      "class": "pedestrian",
      "count": 1,
      "relative_position": "front"
    }
  ]
}
