{
  "metadata": {
    "video_id": "REC_20240610_075719_2_part2",
    "dataset": "Dashcam"
  },
  "environment": {
    "road_type": "Urban",
    "intersection": true,
    "traffic_control": "Traffic signal",
    "weather": "Clear",
    "lighting": "Day"
  },
  "scenario_behavior": {
    "event_type": "Traffic Control",
    "event_pattern": "Causal",
    "severity": "Low",
    "ego_maneuver": "Stop",
    "key_event": "Traffic signal changes from green to amber causing vehicles to slow/stop",
    "time_window": {
      "end_sec": "00:09",
      "start_sec": "00:05"
    }
  },
  "actors": [
    {
      "class": "car",
      "count": 1,
      "relative_position": "front"
    },
    {
      "class": "van",
      "count": 1,
      "relative_position": "front_left"
    },
    {
      "class": "car",
      "count": 1,
      "relative_position": "left"
    },
    {
      "class": "auto_rickshaw",
      "count": 4,
      "relative_position": "front_right"
    },
    {
      "class": "motorcycle",
      "count": 1,
      "relative_position": "front_right"
    }
  ]
}
