{
  "metadata": {
    "video_id": "20211221155505_0060_combined_part1",
    "dataset": "IDD"
  },
  "environment": {
    "road_type": "Urban",
    "intersection": false,
    "traffic_control": "None",
    "weather": "Clear",
    "lighting": "Day"
  },
  "scenario_behavior": {
    "event_type": "Vehicle Interaction",
    "event_pattern": "Co-linear",
    "severity": "Low",
    "ego_maneuver": "Follow",
    "key_event": "A red car in front of the ego vehicle stops, causing traffic congestion.",
    "time_window": {
      "start_sec": "00:00",
      "end_sec": "00:10"
    }
  },
  "actors": [
    {
      "class": "car",
      "count": 1,
      "relative_position": "front"
    }
  ]
}
