{
  "metadata": {
    "video_id": "20220209202432_0060_combined_part3",
    "dataset": "IDD"
  },
  "environment": {
    "road_type": "Urban",
    "intersection": false,
    "traffic_control": "None",
    "weather": "Clear",
    "lighting": "Night"
  },
  "scenario_behavior": {
    "event_type": "Vehicle Interaction",
    "event_pattern": "Co-linear",
    "severity": "Low",
    "ego_maneuver": "Follow",
    "key_event": "A car is following another vehicle on a road at night.",
    "time_window": {
      "start_sec": "00:00",
      "end_sec": "00:10"
    }
  },
  "actors": [
    {
      "class": "car",
      "count": 2,
      "relative_position": "front"
    },
    {
      "class": "motorcycle",
      "count": 1,
      "relative_position": "right"
    }
  ]
}
