{
  "metadata": {
    "video_id": "scene-0467",
    "dataset": "NuScenes"
  },
  "environment": {
    "road_type": "Urban",
    "intersection": true,
    "traffic_control": "Traffic signal",
    "weather": "Rain",
    "lighting": "Day"
  },
  "scenario_behavior": {
    "event_type": "Traffic Control",
    "event_pattern": "Co-linear",
    "severity": "Low",
    "ego_maneuver": "Stop",
    "key_event": "Ego vehicle stopped at red traffic light waiting for signal change.",
    "time_window": {
      "start_sec": "00:00",
      "end_sec": "00:19"
    }
  },
  "actors": [
    {
      "class": "car",
      "count": 1,
      "relative_position": "front_left"
    },
    {
      "class": "truck",
      "count": 1,
      "relative_position": "front_left"
    }
  ]
}
